{"round": 0, "status": "keep", "score": 63.0, "best": 63.0, "mutated": "D3_paper", "ts": "2026-07-04T01:41:02.677017"}
{"round": 0, "status": "keep", "score": 72.0, "best": 72.0, "mutated": "D2_frontmatter", "ts": "2026-07-05T02:46:54.773634"}
{"round": 1, "status": "discard", "score": 59.8, "best": 72.0, "mutated": "D4_roi", "ts": "2026-07-05T02:47:54.935731"}
{"round": 2, "status": "discard", "score": 69.8, "best": 72.0, "mutated": "D4_roi", "ts": "2026-07-05T02:49:00.149216"}
{"round": 3, "status": "keep", "score": 73.0, "best": 73.0, "mutated": "D6_code", "ts": "2026-07-05T02:49:40.456537"}
{"round": 4, "status": "discard", "score": 65.8, "best": 73.0, "mutated": "D4_roi", "ts": "2026-07-05T02:50:36.770020"}
{"round": 0, "status": "rewrite_no_gain", "score": 73.0, "best": 73.0, "mutated": "full_rewrite", "ts": "2026-07-06T03:27:39.857625"}
