{"round": 0, "status": "keep", "score": 66.0, "best": 66.0, "mutated": "D3_paper", "ts": "2026-07-04T03:56:51.442439"}
{"round": 0, "status": "keep", "score": 76.0, "best": 76.0, "mutated": "D2_frontmatter", "ts": "2026-07-05T02:21:40.283385"}
{"round": 1, "status": "discard", "score": 76.0, "best": 76.0, "mutated": "D6_code", "ts": "2026-07-05T02:22:31.810764"}
{"round": 2, "status": "discard", "score": 76.0, "best": 76.0, "mutated": "D6_code", "ts": "2026-07-05T02:23:13.692453"}
{"round": 3, "status": "keep", "score": 87.0, "best": 87.0, "mutated": "D10_three_track", "ts": "2026-07-05T02:24:02.045187"}
