{"round": 0, "status": "keep", "score": 68.0, "best": 68.0, "mutated": "D3_paper", "ts": "2026-07-04T02:26:18.905361"}
{"round": 0, "status": "keep", "score": 75.0, "best": 75.0, "mutated": "D2_frontmatter", "ts": "2026-07-05T03:22:52.572994"}
{"round": 1, "status": "discard", "score": 56.8, "best": 75.0, "mutated": "D10_three_track", "ts": "2026-07-05T03:23:57.421688"}
{"round": 2, "status": "discard", "score": 56.8, "best": 75.0, "mutated": "D10_three_track", "ts": "2026-07-05T03:24:56.316624"}
{"round": 3, "status": "discard", "score": 55.8, "best": 75.0, "mutated": "D7_code_depth", "ts": "2026-07-05T03:25:49.654574"}
{"round": 4, "status": "discard", "score": 55.8, "best": 75.0, "mutated": "D10_three_track", "ts": "2026-07-05T03:26:52.465812"}
{"round": 0, "status": "patch_improved", "score": 86.0, "best": 86.0, "mutated": "track", "ts": "2026-07-05T20:59:34.097082"}
