{"round": 0, "status": "keep", "score": 67.0, "best": 67.0, "mutated": "D2_frontmatter", "ts": "2026-07-04T04:44:18.443885"}
{"round": 0, "status": "keep", "score": 73.0, "best": 73.0, "mutated": "D2_frontmatter", "ts": "2026-07-05T02:53:41.593534"}
{"round": 1, "status": "keep", "score": 77.0, "best": 77.0, "mutated": "D4_roi", "ts": "2026-07-05T02:54:46.075128"}
{"round": 2, "status": "discard", "score": 73.0, "best": 77.0, "mutated": "D4_roi", "ts": "2026-07-05T02:55:35.500923"}
{"round": 3, "status": "discard", "score": 72.0, "best": 77.0, "mutated": "D4_roi", "ts": "2026-07-05T02:56:25.288984"}
{"round": 4, "status": "keep", "score": 83.0, "best": 83.0, "mutated": "D11_crossdomain", "ts": "2026-07-05T02:57:19.418503"}
