{"round": 0, "status": "keep", "score": 61.0, "best": 61.0, "mutated": "D3_paper", "ts": "2026-07-04T02:01:58.803494"}
{"round": 0, "status": "keep", "score": 75.0, "best": 75.0, "mutated": "D2_frontmatter", "ts": "2026-07-05T02:21:17.545230"}
{"round": 1, "status": "discard", "score": 75.0, "best": 75.0, "mutated": "D6_code", "ts": "2026-07-05T02:21:53.944111"}
{"round": 2, "status": "discard", "score": 75.0, "best": 75.0, "mutated": "D6_code", "ts": "2026-07-05T02:22:35.419394"}
{"round": 3, "status": "keep", "score": 84.0, "best": 84.0, "mutated": "D10_three_track", "ts": "2026-07-05T02:23:33.772200"}
{"round": 4, "status": "discard", "score": 84.0, "best": 84.0, "mutated": "D6_code", "ts": "2026-07-05T02:24:21.814718"}
