{"round": 0, "status": "keep", "score": 70.0, "best": 70.0, "mutated": "D3_paper", "ts": "2026-07-04T04:41:32.387536"}
{"round": 0, "status": "keep", "score": 83.0, "best": 83.0, "mutated": "D2_frontmatter", "ts": "2026-07-05T05:51:23.975516"}
{"round": 1, "status": "keep", "score": 84.0, "best": 84.0, "mutated": "D10_three_track", "ts": "2026-07-05T05:52:02.443896"}
{"round": 2, "status": "discard", "score": 61.8, "best": 84.0, "mutated": "D7_code_depth", "ts": "2026-07-05T05:52:56.053761"}
{"round": 3, "status": "discard", "score": 58.8, "best": 84.0, "mutated": "D7_code_depth", "ts": "2026-07-05T05:53:51.028906"}
{"round": 4, "status": "keep", "score": 89.0, "best": 89.0, "mutated": "D8_algo", "ts": "2026-07-05T05:54:39.805620"}
