{"round": 0, "status": "discard", "score": 61.0, "best": 68.0, "mutated": "D3_paper", "ts": "2026-07-04T04:06:32.318500"}
{"round": 0, "status": "keep", "score": 75.0, "best": 75.0, "mutated": "D3_paper", "ts": "2026-07-05T03:37:25.003957"}
{"round": 1, "status": "keep", "score": 81.0, "best": 81.0, "mutated": "D6_code", "ts": "2026-07-05T03:38:04.128764"}
{"round": 2, "status": "discard", "score": 81.0, "best": 81.0, "mutated": "D6_code", "ts": "2026-07-05T03:38:42.639070"}
{"round": 3, "status": "discard", "score": 81.0, "best": 81.0, "mutated": "D6_code", "ts": "2026-07-05T03:39:21.316469"}
{"round": 4, "status": "keep", "score": 87.0, "best": 87.0, "mutated": "D10_three_track", "ts": "2026-07-05T03:40:05.846605"}
