{"round": 0, "status": "keep", "score": 68.0, "best": 68.0, "mutated": "D3_paper", "ts": "2026-07-04T04:49:04.883253"}
{"round": 0, "status": "keep", "score": 75.0, "best": 75.0, "mutated": "D2_frontmatter", "ts": "2026-07-05T03:45:40.938856"}
{"round": 1, "status": "keep", "score": 77.0, "best": 77.0, "mutated": "D6_code", "ts": "2026-07-05T03:46:31.910242"}
{"round": 2, "status": "discard", "score": 77.0, "best": 77.0, "mutated": "D2_frontmatter", "ts": "2026-07-05T03:47:24.761852"}
{"round": 3, "status": "discard", "score": 77.0, "best": 77.0, "mutated": "D2_frontmatter", "ts": "2026-07-05T03:48:18.374236"}
{"round": 4, "status": "discard", "score": 60.8, "best": 77.0, "mutated": "D7_code_depth", "ts": "2026-07-05T03:49:25.425616"}
{"round": 0, "status": "patch_nothing", "score": 82.0, "best": 82.0, "mutated": "none", "ts": "2026-07-05T21:10:23.030434"}
