{"round": 0, "status": "keep", "score": 66.0, "best": 66.0, "mutated": "D3_paper", "ts": "2026-07-04T04:01:24.736159"}
{"round": 0, "status": "discard", "score": 74.0, "best": 74.0, "mutated": "D2_frontmatter", "ts": "2026-07-05T02:25:01.781267"}
{"round": 1, "status": "discard", "score": 74.0, "best": 74.0, "mutated": "D2_frontmatter", "ts": "2026-07-05T02:25:57.473466"}
{"round": 2, "status": "keep", "score": 78.0, "best": 78.0, "mutated": "D6_code", "ts": "2026-07-05T02:26:55.008176"}
{"round": 3, "status": "discard", "score": 78.0, "best": 78.0, "mutated": "D2_frontmatter", "ts": "2026-07-05T02:27:52.418339"}
{"round": 4, "status": "discard", "score": 78.0, "best": 78.0, "mutated": "D2_frontmatter", "ts": "2026-07-05T02:28:42.748699"}
{"round": 0, "status": "patch_nothing", "score": 75.0, "best": 75.0, "mutated": "none", "ts": "2026-07-05T22:30:44.603847"}
{"round": 0, "status": "patch_improved", "score": 75.0, "best": 75.0, "mutated": "track", "ts": "2026-07-06T02:45:40.252065"}
