{"round": 0, "status": "keep", "score": 68.0, "best": 68.0, "mutated": "D3_paper", "ts": "2026-07-04T02:17:57.258580"}
{"round": 0, "status": "keep", "score": 74.0, "best": 74.0, "mutated": "D2_frontmatter", "ts": "2026-07-05T03:16:11.114649"}
{"round": 1, "status": "discard", "score": 61.0, "best": 74.0, "mutated": "D2_frontmatter", "ts": "2026-07-05T03:17:04.072735"}
{"round": 2, "status": "discard", "score": 74.0, "best": 74.0, "mutated": "D2_frontmatter", "ts": "2026-07-05T03:18:12.885976"}
{"round": 3, "status": "discard", "score": 74.0, "best": 74.0, "mutated": "D6_code", "ts": "2026-07-05T03:19:13.483225"}
{"round": 4, "status": "discard", "score": 61.0, "best": 74.0, "mutated": "D2_frontmatter", "ts": "2026-07-05T03:20:14.193751"}
{"round": 0, "status": "rewrite_no_gain", "score": 74.0, "best": 74.0, "mutated": "full_rewrite", "ts": "2026-07-06T03:38:01.429474"}
