{"round": 0, "status": "keep", "score": 70.0, "best": 70.0, "mutated": "D3_paper", "ts": "2026-07-04T04:49:51.964961"}
{"round": 0, "status": "keep", "score": 71.0, "best": 71.0, "mutated": "D2_frontmatter", "ts": "2026-07-05T06:16:10.548184"}
{"round": 1, "status": "discard", "score": 57.0, "best": 71.0, "mutated": "D4_roi", "ts": "2026-07-05T06:17:06.822591"}
{"round": 2, "status": "discard", "score": 63.0, "best": 71.0, "mutated": "D4_roi", "ts": "2026-07-05T06:17:54.457684"}
{"round": 3, "status": "keep", "score": 72.0, "best": 72.0, "mutated": "D6_code", "ts": "2026-07-05T06:18:46.212381"}
{"round": 4, "status": "keep", "score": 76.0, "best": 76.0, "mutated": "D2_frontmatter", "ts": "2026-07-05T06:19:34.897859"}
{"round": 0, "status": "patch_nothing", "score": 76.0, "best": 76.0, "mutated": "none", "ts": "2026-07-05T21:07:21.603925"}
{"round": 0, "status": "patch_nothing", "score": 76.0, "best": 76.0, "mutated": "none", "ts": "2026-07-06T02:38:27.561222"}
