{"round": 0, "status": "keep", "score": 68.4, "best": 68.4, "mutated": "D3_paper", "ts": "2026-07-04T03:12:48.839282"}
{"round": 0, "status": "discard", "score": 54.8, "best": 65.4, "mutated": "D2_frontmatter", "ts": "2026-07-05T03:51:06.590846"}
{"round": 1, "status": "discard", "score": 54.8, "best": 65.4, "mutated": "D2_frontmatter", "ts": "2026-07-05T03:52:00.472996"}
{"round": 2, "status": "keep", "score": 68.2, "best": 68.2, "mutated": "D4_roi", "ts": "2026-07-05T03:53:00.372901"}
{"round": 3, "status": "discard", "score": 68.2, "best": 68.2, "mutated": "D2_frontmatter", "ts": "2026-07-05T03:54:02.481289"}
{"round": 4, "status": "discard", "score": 68.2, "best": 68.2, "mutated": "D2_frontmatter", "ts": "2026-07-05T03:54:58.592525"}
{"round": 0, "status": "patch_nothing", "score": 78.4, "best": 78.4, "mutated": "none", "ts": "2026-07-05T21:14:49.544799"}
{"round": 0, "status": "patch_nothing", "score": 79.4, "best": 79.4, "mutated": "none", "ts": "2026-07-06T02:50:41.342248"}
