{"round": 0, "status": "discard", "score": 63.0, "best": 65.0, "mutated": "D2_frontmatter", "ts": "2026-07-04T04:48:04.130921"}
{"round": 0, "status": "keep", "score": 74.0, "best": 74.0, "mutated": "D2_frontmatter", "ts": "2026-07-05T02:01:42.822425"}
{"round": 1, "status": "keep", "score": 81.0, "best": 81.0, "mutated": "D3_paper", "ts": "2026-07-05T02:02:15.438699"}
{"round": 2, "status": "discard", "score": 53.8, "best": 81.0, "mutated": "D7_code_depth", "ts": "2026-07-05T02:03:15.238548"}
{"round": 3, "status": "discard", "score": 53.8, "best": 81.0, "mutated": "D7_code_depth", "ts": "2026-07-05T02:04:16.849061"}
{"round": 4, "status": "keep", "score": 85.0, "best": 85.0, "mutated": "D8_algo", "ts": "2026-07-05T02:05:14.223822"}
