{"round": 0, "status": "discard", "score": 63.0, "best": 66.4, "mutated": "D10_three_track", "ts": "2026-07-04T04:59:14.011369"}
{"round": 0, "status": "discard", "score": 75.0, "best": 75.4, "mutated": "D10_three_track", "ts": "2026-07-05T02:35:30.456046"}
{"round": 1, "status": "keep", "score": 78.0, "best": 78.0, "mutated": "D10_three_track", "ts": "2026-07-05T02:36:22.591005"}
{"round": 2, "status": "discard", "score": 75.0, "best": 78.0, "mutated": "D10_three_track", "ts": "2026-07-05T02:37:15.768128"}
{"round": 3, "status": "discard", "score": 75.0, "best": 78.0, "mutated": "D10_three_track", "ts": "2026-07-05T02:38:10.958018"}
{"round": 4, "status": "keep", "score": 84.0, "best": 84.0, "mutated": "D11_crossdomain", "ts": "2026-07-05T02:39:03.964605"}
