{"round": 0, "status": "keep", "score": 62.0, "best": 62.0, "mutated": "D3_paper", "ts": "2026-07-04T02:18:30.110941"}
{"round": 0, "status": "keep", "score": 68.0, "best": 68.0, "mutated": "D2_frontmatter", "ts": "2026-07-05T02:33:07.287310"}
{"round": 1, "status": "discard", "score": 64.2, "best": 68.0, "mutated": "D4_roi", "ts": "2026-07-05T02:34:09.915957"}
{"round": 2, "status": "discard", "score": 62.2, "best": 68.0, "mutated": "D4_roi", "ts": "2026-07-05T02:35:04.652296"}
{"round": 3, "status": "keep", "score": 76.0, "best": 76.0, "mutated": "D10_three_track", "ts": "2026-07-05T02:36:06.029362"}
{"round": 4, "status": "discard", "score": 61.2, "best": 76.0, "mutated": "D4_roi", "ts": "2026-07-05T02:37:12.609311"}
{"round": 0, "status": "patch_nothing", "score": 83.0, "best": 83.0, "mutated": "none", "ts": "2026-07-05T21:06:38.679800"}
