{"round": 0, "status": "keep", "score": 71.0, "best": 71.0, "mutated": "D3_paper", "ts": "2026-07-04T02:00:51.065487"}
{"round": 0, "status": "keep", "score": 78.0, "best": 78.0, "mutated": "D2_frontmatter", "ts": "2026-07-05T07:35:02.113390"}
{"round": 1, "status": "discard", "score": 77.0, "best": 78.0, "mutated": "D6_code", "ts": "2026-07-05T07:35:49.894875"}
{"round": 2, "status": "discard", "score": 77.0, "best": 78.0, "mutated": "D6_code", "ts": "2026-07-05T07:36:50.019886"}
{"round": 3, "status": "keep", "score": 81.0, "best": 81.0, "mutated": "D10_three_track", "ts": "2026-07-05T07:37:59.239832"}
{"round": 4, "status": "discard", "score": 81.0, "best": 81.0, "mutated": "D6_code", "ts": "2026-07-05T07:39:15.124055"}
