{"round": 0, "status": "keep", "score": 55.0, "best": 55.0, "mutated": "D3_paper", "ts": "2026-07-04T04:15:12.656423"}
{"round": 0, "status": "discard", "score": 59.8, "best": 68.0, "mutated": "D2_frontmatter", "ts": "2026-07-05T00:49:53.045740"}
{"round": 1, "status": "discard", "score": 59.8, "best": 68.0, "mutated": "D2_frontmatter", "ts": "2026-07-05T00:50:46.870389"}
{"round": 0, "status": "discard", "score": 69.0, "best": 70.0, "mutated": "D2_frontmatter", "ts": "2026-07-05T03:40:49.661136"}
{"round": 1, "status": "discard", "score": 57.8, "best": 70.0, "mutated": "D2_frontmatter", "ts": "2026-07-05T03:41:31.294308"}
{"round": 2, "status": "discard", "score": 60.8, "best": 70.0, "mutated": "D4_roi", "ts": "2026-07-05T03:42:27.434684"}
{"round": 3, "status": "keep", "score": 73.0, "best": 73.0, "mutated": "D2_frontmatter", "ts": "2026-07-05T03:43:06.644010"}
{"round": 4, "status": "discard", "score": 66.2, "best": 73.0, "mutated": "D4_roi", "ts": "2026-07-05T03:44:04.159241"}
{"round": 0, "status": "rewrite_no_gain", "score": 70.0, "best": 70.0, "mutated": "full_rewrite", "ts": "2026-07-06T02:58:09.869911"}
