{"round": 0, "status": "discard", "score": 66.0, "best": 66.4, "mutated": "D10_three_track", "ts": "2026-07-04T05:05:00.082573"}
{"round": 0, "status": "discard", "score": 80.4, "best": 80.4, "mutated": "D10_three_track", "ts": "2026-07-05T02:39:42.060019"}
{"round": 1, "status": "keep", "score": 82.4, "best": 82.4, "mutated": "D10_three_track", "ts": "2026-07-05T02:40:17.996043"}
{"round": 2, "status": "discard", "score": 82.0, "best": 82.4, "mutated": "D10_three_track", "ts": "2026-07-05T02:41:10.913778"}
{"round": 3, "status": "keep", "score": 84.0, "best": 84.0, "mutated": "D10_three_track", "ts": "2026-07-05T02:42:06.780460"}
{"round": 4, "status": "discard", "score": 73.8, "best": 84.0, "mutated": "D10_three_track", "ts": "2026-07-05T02:43:01.435372"}
