{"round": 0, "status": "keep", "score": 70.0, "best": 70.0, "mutated": "D3_paper", "ts": "2026-07-04T04:57:23.468536"}
{"round": 0, "status": "discard", "score": 74.0, "best": 78.0, "mutated": "D2_frontmatter", "ts": "2026-07-05T06:20:54.274786"}
{"round": 1, "status": "discard", "score": 74.0, "best": 78.0, "mutated": "D2_frontmatter", "ts": "2026-07-05T06:21:22.640486"}
{"round": 2, "status": "keep", "score": 87.0, "best": 87.0, "mutated": "D11_crossdomain", "ts": "2026-07-05T06:22:00.609258"}
