{"round": 0, "status": "keep", "score": 65.0, "best": 65.0, "mutated": "D3_paper", "ts": "2026-07-04T01:59:35.607462"}
{"round": 0, "status": "discard", "score": 57.8, "best": 68.0, "mutated": "D2_frontmatter", "ts": "2026-07-05T00:45:06.978887"}
{"round": 1, "status": "discard", "score": 64.2, "best": 68.0, "mutated": "D2_frontmatter", "ts": "2026-07-05T00:46:04.507941"}
{"round": 2, "status": "discard", "score": 62.8, "best": 68.0, "mutated": "D4_roi", "ts": "2026-07-05T00:47:01.458177"}
{"round": 3, "status": "discard", "score": 57.8, "best": 68.0, "mutated": "D2_frontmatter", "ts": "2026-07-05T00:48:05.728296"}
{"round": 4, "status": "keep", "score": 71.2, "best": 71.2, "mutated": "D4_roi", "ts": "2026-07-05T00:49:04.184821"}
{"round": 0, "status": "rewrite_failed", "score": 51.2, "best": 51.2, "mutated": "full_rewrite", "ts": "2026-07-05T10:57:50.137677"}
{"round": 0, "status": "rewrite_no_gain", "score": 71.4, "best": 71.4, "mutated": "full_rewrite", "ts": "2026-07-05T21:18:44.466373"}
{"round": 0, "status": "rewrite_no_gain", "score": 71.4, "best": 71.4, "mutated": "full_rewrite", "ts": "2026-07-06T02:48:58.211946"}
