{"round": 0, "status": "keep", "score": 65.0, "best": 65.0, "mutated": "D2_frontmatter", "ts": "2026-07-04T01:23:36.137750"}
{"round": 0, "status": "keep", "score": 78.0, "best": 78.0, "mutated": "D2_frontmatter", "ts": "2026-07-05T00:42:01.876521"}
{"round": 1, "status": "discard", "score": 65.0, "best": 78.0, "mutated": "D2_frontmatter", "ts": "2026-07-05T00:42:39.203805"}
{"round": 2, "status": "discard", "score": 62.0, "best": 78.0, "mutated": "D2_frontmatter", "ts": "2026-07-05T00:43:27.564691"}
{"round": 3, "status": "keep", "score": 88.0, "best": 88.0, "mutated": "D3_paper", "ts": "2026-07-05T00:44:04.149170"}
