{"round": 0, "status": "keep", "score": 70.0, "best": 70.0, "mutated": "D6_code", "ts": "2026-07-04T02:52:04.835108"}
{"round": 0, "status": "discard", "score": 69.0, "best": 71.0, "mutated": "D2_frontmatter", "ts": "2026-07-05T01:53:17.872902"}
{"round": 1, "status": "discard", "score": 67.0, "best": 71.0, "mutated": "D2_frontmatter", "ts": "2026-07-05T01:54:16.027769"}
{"round": 2, "status": "discard", "score": 70.0, "best": 71.0, "mutated": "D6_code", "ts": "2026-07-05T01:55:13.880129"}
{"round": 3, "status": "discard", "score": 66.0, "best": 71.0, "mutated": "D2_frontmatter", "ts": "2026-07-05T01:57:11.005432"}
{"round": 4, "status": "discard", "score": 66.0, "best": 71.0, "mutated": "D6_code", "ts": "2026-07-05T01:58:07.218639"}
{"round": 0, "status": "discard", "score": 70.0, "best": 70.0, "mutated": "D2_frontmatter", "ts": "2026-07-05T05:12:36.914909"}
{"round": 1, "status": "discard", "score": 70.0, "best": 70.0, "mutated": "D2_frontmatter", "ts": "2026-07-05T05:13:34.671418"}
{"round": 2, "status": "keep", "score": 71.0, "best": 71.0, "mutated": "D6_code", "ts": "2026-07-05T05:14:40.812265"}
{"round": 3, "status": "discard", "score": 69.0, "best": 71.0, "mutated": "D2_frontmatter", "ts": "2026-07-05T05:15:46.372689"}
{"round": 0, "status": "patch_improved", "score": 82.0, "best": 82.0, "mutated": "track", "ts": "2026-07-05T21:17:27.156791"}
