{"round": 0, "status": "discard", "score": 63.0, "best": 63.0, "mutated": "D2_frontmatter", "ts": "2026-07-04T04:28:26.964188"}
{"round": 0, "status": "discard", "score": 69.0, "best": 70.0, "mutated": "D2_frontmatter", "ts": "2026-07-05T03:21:41.032253"}
{"round": 1, "status": "keep", "score": 72.0, "best": 72.0, "mutated": "D2_frontmatter", "ts": "2026-07-05T03:22:17.491352"}
{"round": 2, "status": "keep", "score": 82.0, "best": 82.0, "mutated": "D3_paper", "ts": "2026-07-05T03:22:52.913518"}
{"round": 3, "status": "keep", "score": 85.0, "best": 85.0, "mutated": "D10_three_track", "ts": "2026-07-05T03:23:44.274802"}
