{"round": 0, "status": "keep", "score": 68.0, "best": 68.0, "mutated": "D2_frontmatter", "ts": "2026-07-04T00:23:55.402012"}
{"round": 1, "status": "discard", "score": 68.0, "best": 68.0, "mutated": "D2_frontmatter", "ts": "2026-07-04T00:24:04.128771"}
{"round": 0, "status": "keep", "score": 68.0, "best": 68.0, "mutated": "D2_frontmatter", "ts": "2026-07-04T00:31:29.961008"}
{"round": 1, "status": "discard", "score": 68.0, "best": 68.0, "mutated": "D2_frontmatter", "ts": "2026-07-04T00:31:39.382676"}
{"round": 2, "status": "discard", "score": 68.0, "best": 68.0, "mutated": "D2_frontmatter", "ts": "2026-07-04T00:31:48.711435"}
{"round": 3, "status": "keep", "score": 85.0, "best": 85.0, "mutated": "D3_paper", "ts": "2026-07-04T00:31:58.505703"}
