{"round": 0, "status": "keep", "score": 78.0, "best": 78.0, "mutated": "D3_paper", "ts": "2026-07-04T04:52:00.372420"}
{"round": 0, "status": "keep", "score": 71.0, "best": 71.0, "mutated": "D2_frontmatter", "ts": "2026-07-05T01:54:23.945072"}
{"round": 1, "status": "discard", "score": 69.0, "best": 71.0, "mutated": "D6_code", "ts": "2026-07-05T01:55:08.657908"}
{"round": 2, "status": "discard", "score": 71.0, "best": 71.0, "mutated": "D6_code", "ts": "2026-07-05T01:56:00.628882"}
{"round": 3, "status": "collapsed_revert", "score": 38.8, "best": 71.0, "mutated": "D7_code_depth", "ts": "2026-07-05T01:56:46.669946"}
{"round": 4, "status": "discard", "score": 64.0, "best": 71.0, "mutated": "D6_code", "ts": "2026-07-05T01:57:32.756228"}
{"round": 0, "status": "rewrite_improved", "score": 83.0, "best": 83.0, "mutated": "full_rewrite", "ts": "2026-07-05T21:18:40.592248"}
