{"round": 0, "status": "discard", "score": 62.0, "best": 67.0, "mutated": "D3_paper", "ts": "2026-07-04T03:50:39.105733"}
{"round": 0, "status": "keep", "score": 78.0, "best": 78.0, "mutated": "D3_paper", "ts": "2026-07-05T02:49:27.578822"}
{"round": 1, "status": "discard", "score": 67.2, "best": 78.0, "mutated": "D4_roi", "ts": "2026-07-05T02:50:22.149882"}
{"round": 2, "status": "discard", "score": 62.8, "best": 78.0, "mutated": "D4_roi", "ts": "2026-07-05T02:51:25.421719"}
{"round": 3, "status": "keep", "score": 79.0, "best": 79.0, "mutated": "D10_three_track", "ts": "2026-07-05T02:52:15.633719"}
{"round": 4, "status": "discard", "score": 64.2, "best": 79.0, "mutated": "D4_roi", "ts": "2026-07-05T02:53:13.141632"}
{"round": 0, "status": "patch_nothing", "score": 83.0, "best": 83.0, "mutated": "none", "ts": "2026-07-05T22:42:19.271433"}
