{"round": 0, "status": "discard", "score": 42.8, "best": 70.0, "mutated": "D2_frontmatter", "ts": "2026-07-04T01:54:22.019885"}
{"round": 0, "status": "keep", "score": 80.0, "best": 80.0, "mutated": "D2_frontmatter", "ts": "2026-07-05T04:18:13.573875"}
{"round": 1, "status": "collapsed_revert", "score": 55.8, "best": 80.0, "mutated": "D3_paper", "ts": "2026-07-05T04:19:06.139309"}
{"round": 2, "status": "keep", "score": 81.0, "best": 81.0, "mutated": "D3_paper", "ts": "2026-07-05T04:20:05.046669"}
{"round": 3, "status": "discard", "score": 81.0, "best": 81.0, "mutated": "D2_frontmatter", "ts": "2026-07-05T04:20:58.399038"}
{"round": 4, "status": "keep", "score": 86.0, "best": 86.0, "mutated": "D2_frontmatter", "ts": "2026-07-05T04:21:53.004309"}
