{"round": 0, "status": "discard", "score": 61.0, "best": 61.0, "mutated": "D3_paper", "ts": "2026-07-04T01:55:17.261958"}
{"round": 0, "status": "keep", "score": 75.0, "best": 75.0, "mutated": "D3_paper", "ts": "2026-07-05T02:17:02.348584"}
{"round": 1, "status": "keep", "score": 82.0, "best": 82.0, "mutated": "D6_code", "ts": "2026-07-05T02:17:59.734626"}
{"round": 2, "status": "discard", "score": 80.0, "best": 82.0, "mutated": "D6_code", "ts": "2026-07-05T02:18:51.085633"}
{"round": 3, "status": "discard", "score": 82.0, "best": 82.0, "mutated": "D6_code", "ts": "2026-07-05T02:19:43.685777"}
{"round": 4, "status": "discard", "score": 71.8, "best": 82.0, "mutated": "D10_three_track", "ts": "2026-07-05T02:20:36.487617"}
