{"round": 0, "status": "keep", "score": 70.0, "best": 70.0, "mutated": "D3_paper", "ts": "2026-07-04T02:06:08.615053"}
{"round": 0, "status": "discard", "score": 70.0, "best": 73.0, "mutated": "D2_frontmatter", "ts": "2026-07-05T04:32:53.999552"}
{"round": 1, "status": "keep", "score": 79.0, "best": 79.0, "mutated": "D2_frontmatter", "ts": "2026-07-05T04:33:31.352642"}
{"round": 2, "status": "discard", "score": 72.8, "best": 79.0, "mutated": "D4_roi", "ts": "2026-07-05T04:34:34.000635"}
{"round": 3, "status": "discard", "score": 72.8, "best": 79.0, "mutated": "D4_roi", "ts": "2026-07-05T04:35:43.631243"}
{"round": 4, "status": "keep", "score": 83.0, "best": 83.0, "mutated": "D10_three_track", "ts": "2026-07-05T04:36:41.198219"}
