{"round": 0, "status": "keep", "score": 65.4, "best": 65.4, "mutated": "D3_paper", "ts": "2026-07-04T04:50:21.476282"}
{"round": 0, "status": "keep", "score": 77.4, "best": 77.4, "mutated": "D2_frontmatter", "ts": "2026-07-05T02:05:51.671278"}
{"round": 1, "status": "discard", "score": 58.8, "best": 77.4, "mutated": "D4_roi", "ts": "2026-07-05T02:06:48.120655"}
{"round": 2, "status": "discard", "score": 61.8, "best": 77.4, "mutated": "D4_roi", "ts": "2026-07-05T02:07:54.429189"}
{"round": 3, "status": "discard", "score": 74.4, "best": 77.4, "mutated": "D11_crossdomain", "ts": "2026-07-05T02:08:27.504118"}
{"round": 4, "status": "discard", "score": 70.8, "best": 77.4, "mutated": "D4_roi", "ts": "2026-07-05T02:09:26.222737"}
{"round": 0, "status": "skip_high_score", "score": 91.0, "best": 91.0, "mutated": "none", "ts": "2026-07-05T21:14:16.731265"}
