{"round": 0, "status": "keep", "score": 70.0, "best": 70.0, "mutated": "D3_paper", "ts": "2026-07-04T02:16:13.414509"}
{"round": 0, "status": "keep", "score": 76.0, "best": 76.0, "mutated": "D2_frontmatter", "ts": "2026-07-05T04:44:08.172365"}
{"round": 1, "status": "discard", "score": 70.0, "best": 76.0, "mutated": "D6_code", "ts": "2026-07-05T04:44:49.757697"}
{"round": 2, "status": "discard", "score": 70.0, "best": 76.0, "mutated": "D6_code", "ts": "2026-07-05T04:45:31.782014"}
{"round": 3, "status": "keep", "score": 82.0, "best": 82.0, "mutated": "D10_three_track", "ts": "2026-07-05T04:46:23.179200"}
{"round": 4, "status": "discard", "score": 67.4, "best": 82.0, "mutated": "D6_code", "ts": "2026-07-05T04:47:19.627760"}
