{"round": 0, "status": "keep", "score": 60.0, "best": 60.0, "mutated": "D3_paper", "ts": "2026-07-04T02:01:09.749078"}
{"round": 0, "status": "keep", "score": 78.0, "best": 78.0, "mutated": "D2_frontmatter", "ts": "2026-07-05T02:05:42.324100"}
{"round": 1, "status": "discard", "score": 57.8, "best": 78.0, "mutated": "D4_roi", "ts": "2026-07-05T02:06:36.312896"}
{"round": 2, "status": "discard", "score": 66.8, "best": 78.0, "mutated": "D4_roi", "ts": "2026-07-05T02:07:40.415000"}
{"round": 3, "status": "keep", "score": 91.0, "best": 91.0, "mutated": "D10_three_track", "ts": "2026-07-05T02:08:26.963288"}
