{"round": 0, "status": "keep", "score": 65.0, "best": 65.0, "mutated": "D2_frontmatter", "ts": "2026-07-04T04:09:19.841060"}
{"round": 0, "status": "keep", "score": 68.0, "best": 68.0, "mutated": "D2_frontmatter", "ts": "2026-07-05T01:36:07.929726"}
{"round": 1, "status": "keep", "score": 71.0, "best": 71.0, "mutated": "D2_frontmatter", "ts": "2026-07-05T01:37:18.606892"}
{"round": 2, "status": "discard", "score": 71.0, "best": 71.0, "mutated": "D2_frontmatter", "ts": "2026-07-05T01:37:37.210663"}
{"round": 3, "status": "discard", "score": 71.0, "best": 71.0, "mutated": "D2_frontmatter", "ts": "2026-07-05T01:46:53.344332"}
{"round": 4, "status": "keep", "score": 79.0, "best": 79.0, "mutated": "D3_paper", "ts": "2026-07-05T01:51:15.783057"}
{"round": 0, "status": "patch_nothing", "score": 77.0, "best": 77.0, "mutated": "none", "ts": "2026-07-05T22:40:36.508427"}
{"round": 0, "status": "patch_improved", "score": 85.0, "best": 85.0, "mutated": "track", "ts": "2026-07-06T02:53:27.942932"}
