{"round": 0, "status": "keep", "score": 66.0, "best": 66.0, "mutated": "D3_paper", "ts": "2026-07-04T04:11:11.145971"}
{"round": 0, "status": "keep", "score": 75.0, "best": 75.0, "mutated": "D2_frontmatter", "ts": "2026-07-05T02:29:41.616092"}
{"round": 1, "status": "keep", "score": 75.4, "best": 75.4, "mutated": "D10_three_track", "ts": "2026-07-05T02:30:37.072482"}
{"round": 2, "status": "discard", "score": 58.8, "best": 75.4, "mutated": "D2_frontmatter", "ts": "2026-07-05T02:31:37.687199"}
{"round": 3, "status": "discard", "score": 69.4, "best": 75.4, "mutated": "D2_frontmatter", "ts": "2026-07-05T02:32:40.566595"}
{"round": 4, "status": "discard", "score": 58.8, "best": 75.4, "mutated": "D6_code", "ts": "2026-07-05T02:33:43.345432"}
{"round": 0, "status": "skip_high_score", "score": 87.0, "best": 87.0, "mutated": "none", "ts": "2026-07-05T21:02:10.775692"}
