{"round": 0, "status": "keep", "score": 63.0, "best": 63.0, "mutated": "D3_paper", "ts": "2026-07-04T03:55:41.914673"}
{"round": 0, "status": "keep", "score": 80.0, "best": 80.0, "mutated": "D2_frontmatter", "ts": "2026-07-05T02:59:21.245692"}
{"round": 1, "status": "discard", "score": 80.0, "best": 80.0, "mutated": "D6_code", "ts": "2026-07-05T03:00:03.260638"}
{"round": 2, "status": "discard", "score": 80.0, "best": 80.0, "mutated": "D6_code", "ts": "2026-07-05T03:00:53.560481"}
{"round": 3, "status": "keep", "score": 84.0, "best": 84.0, "mutated": "D10_three_track", "ts": "2026-07-05T03:01:53.639784"}
{"round": 4, "status": "discard", "score": 79.0, "best": 84.0, "mutated": "D6_code", "ts": "2026-07-05T03:02:58.526223"}
